{
  "schema_version": "reasonscript-reasoning-model/1.0",
  "model_id": "FunctionReturn.ReasoningModel",
  "source_ref": {
    "source_id": "function_return",
    "source_kind": "reason_script_source",
    "artifact_refs": {
      "execution_plan": "execution_plan.json",
      "knowledge": "knowledge.json",
      "reason_ir": "reason_ir.json",
      "simulation": "simulation.json"
    }
  },
  "input_state": {
    "input_id": "input_function_return",
    "input_kind": "structured_state",
    "units": [
      {
        "unit_id": "Answer.state.result",
        "unit_type": "calculation_result",
        "value": "Answer.state.result"
      },
      {
        "unit_id": "FunctionReturnStart",
        "unit_type": "state",
        "value": "FunctionReturnStart"
      },
      {
        "unit_id": "Value.return",
        "unit_type": "state",
        "value": "Value.return"
      }
    ],
    "relations": [
      {
        "relation_id": "rel_001",
        "relation_type": "FunctionReturnTransition",
        "source": "FunctionReturnStart",
        "target": "Value.return"
      },
      {
        "relation_id": "rel_002",
        "relation_type": "ResultTransition",
        "source": "Value.return",
        "target": "Answer.state.result"
      }
    ]
  },
  "reasoning_paths": [
    {
      "path_id": "path_main",
      "path_signature": "Value.return",
      "status": "selected",
      "steps": [
        {
          "step_id": "step-1",
          "step_type": "function_return",
          "source": "FunctionReturnStart",
          "target": "Value.return",
          "operation": "FunctionReturnTransition",
          "evidence_refs": [
            "Value.return"
          ]
        },
        {
          "step_id": "step-2",
          "step_type": "calculation",
          "source": "Value.return",
          "target": "Answer.state.result",
          "operation": "ResultTransition",
          "evidence_refs": [
            "Answer-1-result"
          ]
        }
      ],
      "metadata": {
        "branch_decisions": [
          {
            "branch_id": "Value.return",
            "evidence_refs": [],
            "rejected": [
              "Answer-1-result"
            ],
            "selected": "Value.return"
          }
        ]
      }
    }
  ],
  "selected_path_id": "path_main",
  "knowledge_emissions": [
    {
      "knowledge_id": "K001",
      "source_step_id": "step-2",
      "relation": "ResultTransition",
      "source": "FunctionReturnStart",
      "target": "Answer.state.result",
      "evidence_path": [
        "step-1",
        "step-2"
      ],
      "path_signature": "Value.return"
    }
  ],
  "evaluation_target": {
    "target_id": "eval_001",
    "goal": "Answer.state.result",
    "expected_relation": {
      "relation": "ResultTransition",
      "source": "FunctionReturnStart",
      "target": "Answer.state.result"
    },
    "required_checks": [
      "reachability",
      "determinism",
      "evidence_completeness",
      "consistency",
      "branch_traceability"
    ]
  },
  "diagnostics": []
}
